{
  "schemaVersion": 1,
  "id": "scripture-reading",
  "version": 1,
  "name": "Scripture reading",
  "description": "Optional heading and caption, Scripture reference, and imported passage body.",
  "icon": "¶",
  "order": 10,
  "block": {
    "id": "root",
    "type": "scriptureReading",
    "reference": "",
    "translation": "NIV",
    "label": "Reading",
    "weeklyEditable": true,
    "element": {
      "type": "verticalStack",
      "elements": [
        {
          "type": "heading"
        }
      ],
      "presentation": {
        "widthPercent": 100,
        "placement": "left",
        "paddingIn": {
          "top": 0,
          "right": 0,
          "bottom": 0,
          "left": 0
        },
        "marginIn": {
          "top": 0,
          "bottom": 0
        },
        "color": "#00000000",
        "borderWidthPt": 0,
        "borderColor": "#00000000",
        "borderRadiusPt": 0,
        "cellPaddingIn": {
          "top": 0,
          "right": 0,
          "bottom": 0,
          "left": 0
        },
        "cellMarginIn": {
          "top": 0,
          "right": 0,
          "bottom": 0,
          "left": 0
        }
      },
      "layout": {
        "keepTogether": true
      }
    },



    "elements": {
      "heading": {
        "presentation": {
          "widthPercent": 100,
          "placement": "left",
          "textAlign": "left",
          "paddingIn": {
            "top": 0,
            "right": 0,
            "bottom": 0,
            "left": 0
          },
          "marginIn": {
            "top": 0.2,
            "bottom": 0.02
          },
          "fontFamily": "body",
          "fontSizePt": 10,
          "lineHeight": 1.15,
          "fontWeight": "bold",
          "fontStyle": "normal",
          "textTransform": "uppercase",
          "color": "#25302d",
          "borderWidthPt": 0,
          "borderColor": "#25302d",
          "borderRadiusPt": 0
        },
        "layout": {
          "density": "normal",
          "keepTogether": true
        }
      },
      "reference": {
        "presentation": {
          "widthPercent": 100,
          "placement": "left",
          "textAlign": "left",
          "paddingIn": {
            "top": 0,
            "right": 0,
            "bottom": 0,
            "left": 0
          },
          "marginIn": {
            "top": 0,
            "bottom": 0.08
          },
          "fontFamily": "body",
          "fontSizePt": 10,
          "lineHeight": 1.15,
          "fontWeight": "normal",
          "fontStyle": "normal",
          "textTransform": "none",
          "color": "#25302d",
          "borderWidthPt": 0,
          "borderColor": "#25302d",
          "borderRadiusPt": 0
        },
        "layout": {
          "density": "normal",
          "keepTogether": true
        }
      },
      "caption": {
        "presentation": {
          "widthPercent": 100,
          "placement": "left",
          "textAlign": "left",
          "paddingIn": {
            "top": 0,
            "right": 0,
            "bottom": 0,
            "left": 0
          },
          "marginIn": {
            "top": 0,
            "bottom": 0.12
          },
          "fontFamily": "body",
          "fontSizePt": 10,
          "lineHeight": 1.28,
          "fontWeight": "normal",
          "fontStyle": "italic",
          "textTransform": "none",
          "color": "#25302d",
          "borderWidthPt": 0,
          "borderColor": "#25302d",
          "borderRadiusPt": 0
        },
        "layout": {
          "density": "normal",
          "keepTogether": true
        }
      },
      "body": {
        "presentation": {
          "widthPercent": 100,
          "placement": "left",
          "textAlign": "left",
          "paddingIn": {
            "top": 0,
            "right": 0,
            "bottom": 0,
            "left": 0
          },
          "marginIn": {
            "top": 0,
            "bottom": 0
          },
          "fontFamily": "body",
          "fontSizePt": 10,
          "lineHeight": 1.28,
          "fontWeight": "normal",
          "fontStyle": "normal",
          "textTransform": "none",
          "color": "#25302d",
          "borderWidthPt": 0,
          "borderColor": "#25302d",
          "borderRadiusPt": 0
        },
        "layout": {
          "density": "normal"
        }
      }
    },
    "layout": {
      "keepTogether": true,
      "density": "normal"
    },
    "presentation": {
      "widthPercent": 100,
      "placement": "left",
      "textAlign": "left",
      "paddingIn": {
        "top": 0,
        "right": 0,
        "bottom": 0,
        "left": 0
      },
      "marginIn": {
        "top": 0,
        "bottom": 0.12
      },
      "fontFamily": "body",
      "fontSizePt": 10,
      "lineHeight": 1.28,
      "fontWeight": "normal",
      "fontStyle": "normal",
      "textTransform": "none",
      "color": "#25302d",
      "borderWidthPt": 0,
      "borderColor": "#a44d2a",
      "borderRadiusPt": 0
    }
  }
}