{
  "schemaVersion": 1,
  "id": "song",
  "version": 1,
  "name": "Song or hymn",
  "description": "Lyrics or a music image from the shared library.",
  "icon": "♫",
  "order": 20,
  "block": {
    "id": "root",
    "type": "song",
    "songType": "hymn",
    "libraryItemId": "",
    "selection": { "mode": "all" },
    "renderMode": "lyrics",
    "label": "Hymn",
    "weeklyEditable": true,
    "layout": { "keepTogether": true, "density": "normal", "fit": "contain" },
    "presentation": {
      "widthPercent": 100,
      "placement": "left",
      "textAlign": "left",
      "paddingIn": { "top": 0, "right": 0, "bottom": 0, "left": 0 },
      "marginIn": { "top": 0, "bottom": 0.12 },
      "fontFamily": "body",
      "fontSizePt": 10,
      "lineHeight": 1.28,
      "fontWeight": "normal",
      "fontStyle": "normal",
      "textTransform": "none",
      "color": "#25302d",
      "borderWidthPt": 0,
      "borderColor": "#a44d2a",
      "borderRadiusPt": 0
    }
  }
}
