{
  "schemaVersion": 1,
  "id": "heading",
  "version": 1,
  "name": "Heading",
  "description": "A simple heading within the service.",
  "icon": "T",
  "order": 30,
  "block": {
    "id": "root",
    "type": "heading",
    "text": "New heading",
    "layout": { },
    "presentation": {
      "widthPercent": 100,
      "placement": "left",
      "textAlign": "left",
      "paddingIn": { "top": 0, "right": 0, "bottom": 0, "left": 0 },
      "marginIn": { "top": 0.2, "bottom": 0.08 },
      "fontFamily": "body",
      "fontSizePt": 10,
      "lineHeight": 1.28,
      "fontWeight": "bold",
      "fontStyle": "normal",
      "textTransform": "uppercase",
      "color": "#25302d",
      "borderWidthPt": 0,
      "borderColor": "#a44d2a",
      "borderRadiusPt": 0
    }
  }
}
