{
  "schemaVersion": 1,
  "id": "text",
  "version": 1,
  "name": "Text",
  "description": "Structured paragraph content.",
  "icon": "T",
  "order": 60,
  "block": {
    "id": "root",
    "type": "richText",
    "layout": { "density": "normal" },
    "presentation": {
      "widthPercent": 100,
      "placement": "left",
      "textAlign": "left",
      "paddingIn": { "top": 0, "right": 0, "bottom": 0, "left": 0 },
      "marginIn": { "top": 0, "bottom": 0.12 },
      "fontFamily": "body",
      "fontSizePt": 10,
      "lineHeight": 1.28,
      "fontWeight": "normal",
      "fontStyle": "normal",
      "textTransform": "none",
      "color": "#25302d",
      "borderWidthPt": 0,
      "borderColor": "#a44d2a",
      "borderRadiusPt": 0
    },
    "content": [
      {
        "type": "paragraph",
        "children": [{ "type": "text", "text": "New text" }]
      }
    ]
  }
}
