{
  "schemaVersion": 1,
  "id": "responsive-reading",
  "version": 1,
  "name": "Responsive reading",
  "description": "Minister and congregation responses.",
  "icon": "T",
  "order": 70,
  "block": {
    "id": "root",
    "type": "responsiveReading",
    "layout": { "keepTogether": true, "density": "normal" },
    "presentation": {
      "widthPercent": 100,
      "placement": "left",
      "textAlign": "left",
      "paddingIn": { "top": 0, "right": 0, "bottom": 0, "left": 0 },
      "marginIn": { "top": 0, "bottom": 0.12 },
      "fontFamily": "body",
      "fontSizePt": 10,
      "lineHeight": 1.28,
      "fontWeight": "normal",
      "fontStyle": "normal",
      "textTransform": "none",
      "color": "#25302d",
      "borderWidthPt": 0,
      "borderColor": "#a44d2a",
      "borderRadiusPt": 0
    },
    "entries": [
      {
        "role": "leader",
        "reader": "M",
        "content": [
          {
            "type": "paragraph",
            "children": [{ "type": "text", "text": "New leader response" }]
          }
        ]
      },
      {
        "role": "follower",
        "reader": "C",
        "content": [
          {
            "type": "paragraph",
            "children": [{ "type": "text", "text": "New follower response" }]
          }
        ]
      }
    ]
  }
}
